{"schemaVersion":3,"family":"terms","kind":"leaf","entries":[["g\u0000s",{"path":"catalog/v3/2a/2a18ea197cd07474cc9e4905a003235d480509588ab341384cf6e4c4eccc3d7e.json","size":2352,"sha256":"2a18ea197cd07474cc9e4905a003235d480509588ab341384cf6e4c4eccc3d7e","min":0,"max":598,"count":599,"height":1}]]}
