{"schemaVersion":3,"family":"sources","kind":"leaf","entries":[["tailoring-hollow-sleeveless-sample-display-v1",{"owner":"shAdow-XJY-Games","repo":"Shadow3DAssetLibrary","commit":"d66064d0aa26125eb51191d0a9c5c1b9ca34e958"}],["tailoring-open-blade-shears-v1",{"owner":"shAdow-XJY-Games","repo":"Shadow3DAssetLibrary","commit":"5cc74a1a760681502ae7f1d97ca6a7def8523d3d"}],["tailoring-seamed-pin-cushion-kit-v1",{"owner":"shAdow-XJY-Games","repo":"Shadow3DAssetLibrary","commit":"bbdd1779d5dcaf8ab1ef5c14b64a3b4c019c350e"}],["tailoring-service-pair",{"owner":"shAdow-XJY-Games","repo":"Shadow3DAssetLibrary","commit":"9820bb726f6eb90a76893367f2c5006311736844"}],["tailoring-straight-and-curve-pattern-ruler-v1",{"owner":"shAdow-XJY-Games","repo":"Shadow3DAssetLibrary","commit":"8a1374f95545aa595f757b8f5fd8f14545d527b5"}],["textile-extension",{"owner":"shAdow-XJY-Games","repo":"Shadow3DAssetLibrary","commit":"da98017cc28db6c78f26b071017ab4e075be42b2"}],["textile-hollow-boat-shuttle-v1",{"owner":"shAdow-XJY-Games","repo":"Shadow3DAssetLibrary","commit":"c60278076ef368e27cc13ca991657e82b9ffc8b3"}],["textile-spinning-wheel-v1",{"owner":"shAdow-XJY-Games","repo":"Shadow3DAssetLibrary","commit":"db47bf43a27a380a4c197faaebdacf8a101f17cd"}],["textile-suspended-basket-dye-vat-v1",{"owner":"shAdow-XJY-Games","repo":"Shadow3DAssetLibrary","commit":"a24a9f887820cbae53e1c0dfae98743f9fb852ea"}],["textile-three-tier-shuttle-cradle-rack-v1",{"owner":"shAdow-XJY-Games","repo":"Shadow3DAssetLibrary","commit":"27ab7ec44e785149820c2746cf17660188395b57"}],["textile-tiered-peg-spool-rack-kit-v1",{"owner":"shAdow-XJY-Games","repo":"Shadow3DAssetLibrary","commit":"13b7cf92376ba1ace01cba35601e98c514015008"}],["timekeeping-extension",{"owner":"shAdow-XJY-Games","repo":"Shadow3DAssetLibrary","commit":"e1a7337c024b4de3e257c5cac2fec13be386d2fa"}],["timekeeping-fixed-spur-gear-study-kit-v1",{"owner":"shAdow-XJY-Games","repo":"Shadow3DAssetLibrary","commit":"aaab1e349c8071fd94e38a498f5a78f1f304e820"}],["timekeeping-four-face-arch-clock-tower-v1",{"owner":"shAdow-XJY-Games","repo":"Shadow3DAssetLibrary","commit":"263a561c6084b0932e0c1eb053e7e45705ef22b3"}],["timekeeping-pocket-watch-display-v1",{"owner":"shAdow-XJY-Games","repo":"Shadow3DAssetLibrary","commit":"dbac1104cba629203fedaafe4486f6ac34236134"}],["timekeeping-recess-front-watchmaker-bench-v1",{"owner":"shAdow-XJY-Games","repo":"Shadow3DAssetLibrary","commit":"134b1a85046b9fd19ab8d31b6e13622a816efde0"}],["timekeeping-twin-bell-alarm-clock-v1",{"owner":"shAdow-XJY-Games","repo":"Shadow3DAssetLibrary","commit":"ccf918590ab8f31607e57983f5dcbc61970a0ad9"}],["toys-bored-body-wooden-car-v1",{"owner":"shAdow-XJY-Games","repo":"Shadow3DAssetLibrary","commit":"40541209cb11466d539c4097ab66fd75e510c757"}],["toys-finger-spinning-top-v1",{"owner":"shAdow-XJY-Games","repo":"Shadow3DAssetLibrary","commit":"595609cdd676c2eb92568b2e158446c6b55043cf"}],["toys-grooved-puzzle-track-quarter-v1",{"owner":"shAdow-XJY-Games","repo":"Shadow3DAssetLibrary","commit":"48b13963059c99547a8e68e5cebf66c525b0273f"}],["toys-open-oven-play-kitchen-v1",{"owner":"shAdow-XJY-Games","repo":"Shadow3DAssetLibrary","commit":"f6cee83980b1dea2b729830784e134bf49cd1e4b"}],["toys-seated-plush-bear-v1",{"owner":"shAdow-XJY-Games","repo":"Shadow3DAssetLibrary","commit":"e7644a3f99aa6f14b3aba8c28b13cb3c24019a9a"}],["toys-six-wheel-steam-locomotive-v1",{"owner":"shAdow-XJY-Games","repo":"Shadow3DAssetLibrary","commit":"7d447cca7731b72712282a19564ca8e46c36c9e8"}],["transport-compact-cargo-trailer-v1",{"owner":"shAdow-XJY-Games","repo":"Shadow3DAssetLibrary","commit":"90362f1936f764928871e77b608201eab472873a"}],["transport-curb-corner-v1",{"owner":"shAdow-XJY-Games","repo":"Shadow3DAssetLibrary","commit":"d6844840bca317c97af21fc63950a6cbce8fdbc0"}],["transport-cycle-rack-v2",{"owner":"shAdow-XJY-Games","repo":"Shadow3DAssetLibrary","commit":"33ef114359b1beefa944631d60e28df4d21599df"}],["transport-extension",{"owner":"shAdow-XJY-Games","repo":"Shadow3DAssetLibrary","commit":"cf2ba6d65d800436d1a5cf490d86e8f8ef51aa1e"}],["transport-open-bed-pickup-v1",{"owner":"shAdow-XJY-Games","repo":"Shadow3DAssetLibrary","commit":"196048dc71e63e4cb827f847e161cdae2cb88582"}],["transport-passenger-minibus-v1",{"owner":"shAdow-XJY-Games","repo":"Shadow3DAssetLibrary","commit":"3637fe01bad6304fbe01a090b28b6109b6f1180b"}],["transport-passenger-waiting-station-scene-v1",{"owner":"shAdow-XJY-Games","repo":"Shadow3DAssetLibrary","commit":"edc51e60ba13d3c564d6efb5c0f6adddce600cbc"}],["transport-raised-platform-ramp-v1",{"owner":"shAdow-XJY-Games","repo":"Shadow3DAssetLibrary","commit":"7ed31f3e84813490a3ceab88bb591153232caaa8"}],["transport-single-space-parking-meter-v1",{"owner":"shAdow-XJY-Games","repo":"Shadow3DAssetLibrary","commit":"2f32a16f2f03759e3abc6f894d6e4f6ee61597b7"}],["transport-wheel-chock-v1",{"owner":"shAdow-XJY-Games","repo":"Shadow3DAssetLibrary","commit":"fbdf3661740f9600b634b767906816f7df3575f6"}],["verified-description-maintenance",{"owner":"shAdow-XJY-Games","repo":"Shadow3DAssetLibrary","commit":"09bf715a9817d4e3a027b9f71bcdf1fafee7f488"}],["village-cottage-h01-v2",{"owner":"shAdow-XJY-Games","repo":"Shadow3DAssetLibrary","commit":"4e5591c8651f74714f2975b2bfba0a34d63fe59f"}],["village-extension",{"owner":"shAdow-XJY-Games","repo":"Shadow3DAssetLibrary","commit":"160d3c11a135e5cd534594721d5e7d8af24d7e0e"}],["village-open-storehouse-scene-v1",{"owner":"shAdow-XJY-Games","repo":"Shadow3DAssetLibrary","commit":"bdc5e0ee2d14434022c28132c2dfd7b0596e1639"}],["village-residential-street-scene-v1",{"owner":"shAdow-XJY-Games","repo":"Shadow3DAssetLibrary","commit":"1b6c60d5d49fd534fd5748604a0e154411912a47"}],["village-two-storey-shop-house-v1",{"owner":"shAdow-XJY-Games","repo":"Shadow3DAssetLibrary","commit":"3bc5c06530cbc0da61a55138b852607b18b800f7"}],["warehouse-rack-extension",{"owner":"shAdow-XJY-Games","repo":"Shadow3DAssetLibrary","commit":"e4d03e539e73402b62c85fd38bb1a4ec3c9a4f94"}],["water-receiver",{"owner":"shAdow-XJY-Games","repo":"Shadow3DAssetLibrary","commit":"afe8be0d0d9d72275bcfa1fae99a30ff147c572b"}],["wetland-arched-prop-root-mangrove-v1",{"owner":"shAdow-XJY-Games","repo":"Shadow3DAssetLibrary","commit":"a4cf515f3e89a93bc37c37430e71437f2a225cb9"}],["wetland-articulated-reed-clump-v1",{"owner":"shAdow-XJY-Games","repo":"Shadow3DAssetLibrary","commit":"beaca9f612a6c53949403019282d81f03a7c0d43"}],["wetland-boardwalk-observation-scene-v1",{"owner":"shAdow-XJY-Games","repo":"Shadow3DAssetLibrary","commit":"c539cdc595700eebfe324ef3144b326f41d4e482"}],["window-corner-extension",{"owner":"shAdow-XJY-Games","repo":"Shadow3DAssetLibrary","commit":"1588f9e8c66cb36fa9aeaa0b6a0576af61c6942d"}],["winter-alpine-ski-pair-v1",{"owner":"shAdow-XJY-Games","repo":"Shadow3DAssetLibrary","commit":"4a51d1cce45e5630083746f40ccb2dcee85f0435"}],["winter-drip-fringe-icicle-cluster-v1",{"owner":"shAdow-XJY-Games","repo":"Shadow3DAssetLibrary","commit":"7f779bb81493408e66a4b87d8d5e7731a99a0bb0"}],["winter-extension",{"owner":"shAdow-XJY-Games","repo":"Shadow3DAssetLibrary","commit":"4a50da07c8f63221d22484a8c897ed38ef849886"}],["winter-hollow-snow-boot-pair-v1",{"owner":"shAdow-XJY-Games","repo":"Shadow3DAssetLibrary","commit":"fd3a5d72ee54161bca5d927c3f3625fe35ecfb43"}],["winter-sloped-eave-snow-cap-v1",{"owner":"shAdow-XJY-Games","repo":"Shadow3DAssetLibrary","commit":"824f02e22b63c41bceb792c308ceb5fc20782fc2"}],["winter-wide-scoop-snow-shovel-v1",{"owner":"shAdow-XJY-Games","repo":"Shadow3DAssetLibrary","commit":"947af94bf2e9d2014002181781b5d264bc0165a0"}],["workshop-hero-h04",{"owner":"shAdow-XJY-Games","repo":"Shadow3DAssetLibrary","commit":"966f2de8926053ebbe2641052479e781ca3e7044"}]]}
