{"schemaVersion":3,"family":"records","kind":"branch","children":[{"path":"catalog/v3/b2/b22dbbd52e3dcb26372d4cf3827ac3a0a94192798ba1345f205319c42d221ae3.json","size":28735,"sha256":"b22dbbd52e3dcb26372d4cf3827ac3a0a94192798ba1345f205319c42d221ae3","min":0,"max":23,"count":24,"height":1},{"path":"catalog/v3/4a/4af432e59b1e65146248fd9e0742b9a3a815d9ecf144234f48920a9563231327.json","size":29939,"sha256":"4af432e59b1e65146248fd9e0742b9a3a815d9ecf144234f48920a9563231327","min":24,"max":47,"count":24,"height":1},{"path":"catalog/v3/52/521891fff0693ab75bc3d6714b92addcea83fe030934390910372d3c0012da39.json","size":28791,"sha256":"521891fff0693ab75bc3d6714b92addcea83fe030934390910372d3c0012da39","min":48,"max":71,"count":24,"height":1},{"path":"catalog/v3/bf/bf8422c879a78e3c22fb204ab0b7ce2880ff4fe497c26910d8c4714cb5cd3a7c.json","size":38848,"sha256":"bf8422c879a78e3c22fb204ab0b7ce2880ff4fe497c26910d8c4714cb5cd3a7c","min":72,"max":95,"count":24,"height":1},{"path":"catalog/v3/be/be92965039052ba0c4929629772a9576253df9cedf5d5fe4de13d020b47f5146.json","size":37349,"sha256":"be92965039052ba0c4929629772a9576253df9cedf5d5fe4de13d020b47f5146","min":96,"max":119,"count":24,"height":1},{"path":"catalog/v3/4e/4e9d510e8feeb7bd6d7025704b44935143765ac72544f001a6ff568a8e00713d.json","size":33070,"sha256":"4e9d510e8feeb7bd6d7025704b44935143765ac72544f001a6ff568a8e00713d","min":120,"max":143,"count":24,"height":1},{"path":"catalog/v3/1c/1cc2d8e7dcb1ea475255bed5dd49df59cc7ab7f6fd7c2c4809188ac2f8430711.json","size":34722,"sha256":"1cc2d8e7dcb1ea475255bed5dd49df59cc7ab7f6fd7c2c4809188ac2f8430711","min":144,"max":167,"count":24,"height":1},{"path":"catalog/v3/25/251b44225cada7cd0d90325fbf08e6579759f0bdfcc849f4a601c1ba55c16daa.json","size":36975,"sha256":"251b44225cada7cd0d90325fbf08e6579759f0bdfcc849f4a601c1ba55c16daa","min":168,"max":191,"count":24,"height":1},{"path":"catalog/v3/4b/4b0dbc3b6e942305c35158cc82376eeb0812d9dd94fb0328f34b54a85a36462d.json","size":33013,"sha256":"4b0dbc3b6e942305c35158cc82376eeb0812d9dd94fb0328f34b54a85a36462d","min":192,"max":215,"count":24,"height":1},{"path":"catalog/v3/9c/9c430330f8bf8b3bb62cf71d60e9e693ad0e9637f3803f832c566a6baad483b4.json","size":34054,"sha256":"9c430330f8bf8b3bb62cf71d60e9e693ad0e9637f3803f832c566a6baad483b4","min":216,"max":239,"count":24,"height":1},{"path":"catalog/v3/14/14a7d5198461f66873bafaad2135edc0cec38b44475293cbea95af95dd936220.json","size":35808,"sha256":"14a7d5198461f66873bafaad2135edc0cec38b44475293cbea95af95dd936220","min":240,"max":263,"count":24,"height":1},{"path":"catalog/v3/d7/d74fdd513b32ff187f14941b017adb011999f79894dcca5c47180dc30597f5ff.json","size":43402,"sha256":"d74fdd513b32ff187f14941b017adb011999f79894dcca5c47180dc30597f5ff","min":264,"max":287,"count":24,"height":1},{"path":"catalog/v3/9d/9d1e46a25144560280198e527b32af463b35d22fb2b72e2ddbe0a62e3cb7f86e.json","size":47988,"sha256":"9d1e46a25144560280198e527b32af463b35d22fb2b72e2ddbe0a62e3cb7f86e","min":288,"max":311,"count":24,"height":1},{"path":"catalog/v3/45/4530c6c324abadb7bd1a1b679c09ecafc4771384a1ec295226526754f5b0cba5.json","size":46658,"sha256":"4530c6c324abadb7bd1a1b679c09ecafc4771384a1ec295226526754f5b0cba5","min":312,"max":332,"count":21,"height":1},{"path":"catalog/v3/39/3929f31f460c019ce879f66684f90c079a174cd5bebcde48b3c04d807da36e51.json","size":47341,"sha256":"3929f31f460c019ce879f66684f90c079a174cd5bebcde48b3c04d807da36e51","min":333,"max":353,"count":21,"height":1},{"path":"catalog/v3/7f/7f8d2a2f7198172bed8c3fab79b1b299024819f2474eb766cf55e37e265ae897.json","size":48701,"sha256":"7f8d2a2f7198172bed8c3fab79b1b299024819f2474eb766cf55e37e265ae897","min":354,"max":373,"count":20,"height":1},{"path":"catalog/v3/8d/8dc7ea2ea1a34ce6c34bb27789b83f698a05bfcbf7a1c050e38dd849415af6d6.json","size":46907,"sha256":"8dc7ea2ea1a34ce6c34bb27789b83f698a05bfcbf7a1c050e38dd849415af6d6","min":374,"max":392,"count":19,"height":1},{"path":"catalog/v3/d2/d20ca92d95358791b98827756d1ec66fbe82519b08a4355fc53f5905ff5a1d73.json","size":47461,"sha256":"d20ca92d95358791b98827756d1ec66fbe82519b08a4355fc53f5905ff5a1d73","min":393,"max":410,"count":18,"height":1},{"path":"catalog/v3/a5/a5d54607836122bd2ab4300fa7b8527a267126b6d69866c14462935b36b82f7d.json","size":46636,"sha256":"a5d54607836122bd2ab4300fa7b8527a267126b6d69866c14462935b36b82f7d","min":411,"max":428,"count":18,"height":1},{"path":"catalog/v3/59/594c259c0d578dabb7c56c0a844c4cd502127ad6a827b70284c7923bcd958ce0.json","size":47422,"sha256":"594c259c0d578dabb7c56c0a844c4cd502127ad6a827b70284c7923bcd958ce0","min":429,"max":446,"count":18,"height":1},{"path":"catalog/v3/7d/7d94a872ffa83027300876e3decb9d072acba5be8aaca30493ffc04920102b85.json","size":47164,"sha256":"7d94a872ffa83027300876e3decb9d072acba5be8aaca30493ffc04920102b85","min":447,"max":464,"count":18,"height":1},{"path":"catalog/v3/43/43e252a6ff15febceae48553761142fbaf8d55d6128e8e77e837dfa09d24eaa8.json","size":47781,"sha256":"43e252a6ff15febceae48553761142fbaf8d55d6128e8e77e837dfa09d24eaa8","min":465,"max":484,"count":20,"height":1},{"path":"catalog/v3/3c/3cffa435d05fad21bc407b6d3d38ddf3d363d8ebd7a602f342639d14f413e69f.json","size":2233,"sha256":"3cffa435d05fad21bc407b6d3d38ddf3d363d8ebd7a602f342639d14f413e69f","min":485,"max":485,"count":1,"height":1}]}
