{"schemaVersion":3,"family":"terms","kind":"leaf","entries":[["g\u0000a ",{"ids":[1,5,8,11,12,16,18,19,21,22,23,24,25,26,29,31,32,33,34,35,36,38,43,44,45,47,50,53,60,61,63,66,68,69,70,71,73,74,75,76,77,79,80,81,82,83,90,91,92,93,94,95,96,97,98,99,100,104,105,107,109,110,111,112,113,114,116,117,119,120,122,123,125,127,130,131,132,134,135,136,137,138,139,140,144,145,146,147,148,149,151,152,153,155,156,157,158,160,162,163,164,165,166,167,168,169,176,179,180,182,183,184,185,186,187,188,189,195,197,198,199,200,201,204,205,207,208,209,210,211,213,214,215,216,217,218,219,221,222,224,225,227,229,230,231,233,237,240,244,245,246,251,252,254,255,256,257,258,259,260,261,262,263,264,265,266,267,268,270,271,272,273,274,275,276,277,280,281,282,283,284,287,290,291,292,293,294,295,296,297,298,299,300,301,302,303,304,305,307,308,309,310,312,313,314,315,316,317,318,319,320,321,322,323,324,325,326,327,328,329,330,331,332,333,334,335,336,337,338,339,340,341,342,343,344,345,346,347,348,349,350,351,352,353,354,355,356,357,358,359,361,362,363,364,365,366,367,368,369,370,371,372,373,374,375,376,377,378,379,380,381,382,383,384,385,386,387,388,389,390,391,392,393,394,395,396,397,398,399,400,401,402,403,404,405,406,407,408,409,410,411,412,413,415,416,417,418,419,420,421,422,423,424,425,426,427,428,429,430,431,432,433,434,435,436,437,438,439,441,442,443,444,445,446,447,448,449,450,451,452,453,454,455,456,457,458,459,460,461,462,463,464,465,466,467,468,469,470,471,472,473,474,475,476,477,478,479,480,481,482,483,484,486,487,488,489,490,491,492,494,495,496,497,498,499,500,501,502,503,504,505,506,507,508,509,510,511,512,513,514,515,516,517,518,519,520,521,522],"count":408,"min":1,"max":522}],["g\u0000a +",{"ids":[131],"count":1,"min":131,"max":131}],["g\u0000a .",{"ids":[83],"count":1,"min":83,"max":83}],["g\u0000a 0",{"ids":[71,92,195,217,218,244,371,448],"count":8,"min":71,"max":448}],["g\u0000a 1",{"ids":[109,157,158,189,198,282,302,304,331,335,423,462,466,480,488],"count":15,"min":109,"max":488}],["g\u0000a 2",{"ids":[81,92,93,164,168,186,189,224,237,245,295,309,318,330,373],"count":15,"min":81,"max":373}],["g\u0000a 3",{"ids":[155,166,197,200,208,219,240],"count":7,"min":155,"max":240}],["g\u0000a 4",{"ids":[21,100,104,157,179,201,287,449],"count":8,"min":21,"max":449}],["g\u0000a 6",{"ids":[21,163,187],"count":3,"min":21,"max":187}],["g\u0000a 7",{"ids":[299],"count":1,"min":299,"max":299}],["g\u0000a 9",{"ids":[127,305,445],"count":3,"min":127,"max":445}],["g\u0000a a",{"ids":[119,160,282,361,448,463,466,487],"count":8,"min":119,"max":487}],["g\u0000a b",{"ids":[21,125,132,134,137,210,263,270,271,294,298,302,314,316,317,318,323,326,329,333,334,340,343,344,347,348,351,352,357,358,363,365,366,370,378,385,391,395,399,401,403,405,407,411,412,416,417,419,420,422,428,430,431,432,436,439,446,447,449,458,496,500,502,503,507,510,513,515,519,521],"count":70,"min":21,"max":521}],["g\u0000a c",{"ids":[19,31,73,76,94,96,104,107,110,117,120,123,125,132,135,136,144,147,185,197,198,207,208,210,227,229,230,233,251,261,263,268,270,272,273,275,291,292,298,316,317,318,322,323,326,330,331,334,336,340,342,343,345,347,351,354,357,361,364,365,366,367,369,371,372,373,375,376,381,384,385,391,393,396,398,402,404,405,406,407,408,410,412,415,416,417,418,419,420,422,423,424,426,428,429,430,431,432,433,437,438,441,442,443,444,447,448,449,450,451,452,453,454,455,456,459,460,461,462,463,465,466,467,473,475,476,478,479,480,481,482,487,496,498,500,502,503,504,506,507,508,510,511,512,514,516,517,518,519,520,521],"count":151,"min":19,"max":521}],["g\u0000a d",{"ids":[32,43,74,75,82,105,113,211,258,260,262,267,273,307,318,320,359,364,365,366,371,379,397,402,419,437,449,462,475,483,516,522],"count":32,"min":32,"max":522}],["g\u0000a e",{"ids":[366,368],"count":2,"min":366,"max":368}],["g\u0000a f",{"ids":[5,11,60,116,130,146,153,155,156,199,224,240,255,259,260,270,271,274,292,297,307,312,314,315,322,324,325,327,331,332,333,334,336,337,338,339,340,341,342,346,348,353,355,357,358,362,363,364,366,369,373,374,376,377,379,380,383,384,385,387,390,391,394,395,397,398,401,404,405,406,407,409,410,412,413,415,416,420,423,426,428,430,431,432,436,437,438,441,445,446,454,457,458,463,464,468,472,474,478,480,481,482,483,487,489,491,495,499,516,518,519,520],"count":112,"min":5,"max":520}],["g\u0000a g",{"ids":[8,23,33,61,97,112,117,152,156,157,167,176,188,199,213,258,276,296,297,305,307,310,312,315,321,326,327,333,336,349,350,353,356,363,370,371,379,381,384,388,390,395,397,400,401,402,404,405,406,407,408,409,410,411,412,416,424,429,431,444,445,454,455,461,463,469,473,474,482,483,489,497,500],"count":73,"min":8,"max":500}],["g\u0000a h",{"ids":[26,60,73,90,107,136,219,304,309,321,323,326,347,351,376,379,385,401,415,418,443,504,507],"count":23,"min":26,"max":507}],["g\u0000a i",{"ids":[284,501],"count":2,"min":284,"max":501}],["g\u0000a j",{"ids":[47],"count":1,"min":47,"max":47}],["g\u0000a l",{"ids":[16,34,69,70,80,91,137,139,152,155,225,256,265,281,296,297,304,305,316,325,328,335,337,341,349,352,356,361,373,377,382,385,400,402,405,408,409,423,427,431,437,438,439,441,444,460,461,473,484,487,491,503,508],"count":53,"min":16,"max":508}],["g\u0000a m",{"ids":[33,44,70,122,157,185,195,266,284,303,320,342,346,401,492],"count":15,"min":33,"max":492}],["g\u0000a n",{"ids":[24,36,81,117,169,210,227,260,294,300,313,318,326,350,369,376,394,402,407,416,423,424,428,431,436,448,455,466,477,479,488],"count":31,"min":24,"max":488}],["g\u0000a o",{"ids":[149,162,195,221,300,358,374,482,486,522],"count":10,"min":149,"max":522}],["g\u0000a p",{"ids":[63,160,163,180,197,222,229,258,280,314,319,333,358,362,364,367,368,376,392,398,401,426,439,445,449,452,461,472,498,500,501,509],"count":32,"min":63,"max":509}],["g\u0000a q",{"ids":[79,481],"count":2,"min":79,"max":481}],["g\u0000a r",{"ids":[22,83,96,107,109,117,136,145,156,167,169,184,185,216,231,245,261,264,267,273,274,277,292,294,301,303,308,309,312,314,315,316,318,320,321,322,323,324,329,332,333,334,335,338,339,340,344,346,347,349,351,352,353,355,359,362,366,369,377,378,379,382,389,395,399,404,405,406,408,409,411,413,416,417,420,422,423,425,426,427,428,430,431,432,433,437,442,444,452,457,463,468,469,470,471,473,475,478,482,490,508,516,517,518,522],"count":105,"min":22,"max":522}],["g\u0000a s",{"ids":[1,18,24,25,32,33,35,36,38,44,45,50,63,68,80,83,91,92,93,95,97,98,105,120,134,136,140,151,157,165,166,169,179,180,182,183,185,186,187,201,204,205,207,208,209,214,237,240,251,254,255,256,257,259,260,261,267,271,275,276,290,292,293,297,298,299,300,301,303,307,309,314,316,317,320,321,322,323,324,325,327,328,329,331,333,334,335,337,338,339,340,342,343,344,346,347,349,350,351,353,355,356,357,358,359,361,364,367,368,370,371,372,373,374,375,378,379,382,384,386,387,390,391,394,395,396,397,398,400,401,402,403,405,406,407,410,413,415,418,419,420,421,423,424,426,429,431,433,434,435,437,438,441,442,445,447,449,450,452,456,457,458,459,460,461,462,463,464,465,466,467,471,472,473,474,478,490,491,496,497,499,500,501,502,503,504,507,508,509,510,515,516,517,520,522],"count":195,"min":1,"max":522}],["g\u0000a t",{"ids":[12,29,44,66,77,111,114,144,148,151,155,195,197,211,217,231,240,246,252,258,261,265,267,273,274,275,283,290,297,308,317,319,322,323,325,327,330,331,334,337,338,339,341,343,346,348,350,352,355,362,363,364,366,368,372,374,376,378,382,385,387,392,395,399,400,401,402,404,406,411,412,413,415,417,421,424,425,428,429,430,431,432,435,436,437,438,439,445,447,448,454,456,457,461,464,468,472,478,480,491,494,496,497,505,506,507,512,516,518],"count":109,"min":12,"max":518}],["g\u0000a u",{"ids":[321,371,396],"count":3,"min":321,"max":396}],["g\u0000a v",{"ids":[36,116,165,215,271,292,295,308,325,340,371,387,453,482,494,512,516],"count":17,"min":36,"max":516}],["g\u0000a w",{"ids":[53,99,104,138,149,151,162,210,219,308,314,322,326,336,340,350,359,371,386,397,402,413,422,434,437,443,444,457,471,473,474,486,509,521],"count":34,"min":53,"max":521}],["g\u0000a y",{"ids":[329],"count":1,"min":329,"max":329}],["g\u0000a,",{"ids":[144,300,374,412,437,462,482,487,507,522],"count":10,"min":144,"max":522}],["g\u0000a, ",{"ids":[144,300,374,412,437,462,482,487,507,522],"count":10,"min":144,"max":522}],["g\u0000a-",{"ids":[6,7,37,125,132,149,162,195,276,300,305,328,329,374,394,412,418,442,470,482,488],"count":21,"min":6,"max":488}],["g\u0000a-0",{"ids":[37,149,162,195,300,482],"count":6,"min":37,"max":482}],["g\u0000a-b",{"ids":[125,132,412,442],"count":4,"min":125,"max":442}],["g\u0000a-f",{"ids":[6,7,276,328,329,394,418,470,488],"count":9,"min":6,"max":488}],["g\u0000a-o",{"ids":[470],"count":1,"min":470,"max":470}],["g\u0000a-s",{"ids":[305,328,374],"count":3,"min":305,"max":374}],["g\u0000a.",{"ids":[185,314,522],"count":3,"min":185,"max":522}],["g\u0000a. ",{"ids":[185,314,522],"count":3,"min":185,"max":522}],["g\u0000a/",{"ids":[330],"count":1,"min":330,"max":330}],["g\u0000a/l",{"ids":[330],"count":1,"min":330,"max":330}],["g\u0000a0",{"ids":[159,258],"count":2,"min":159,"max":258}],["g\u0000a0-",{"ids":[159],"count":1,"min":159,"max":159}],["g\u0000a0.",{"ids":[258],"count":1,"min":258,"max":258}],["g\u0000a4",{"ids":[273,284],"count":2,"min":273,"max":284}],["g\u0000a4 ",{"ids":[273,284],"count":2,"min":273,"max":284}],["g\u0000a;",{"ids":[330],"count":1,"min":330,"max":330}],["g\u0000a; ",{"ids":[330],"count":1,"min":330,"max":330}]]}
