{"schemaVersion":3,"family":"facets","kind":"leaf","entries":[["assetKind\u0000modular",112],["assetKind\u0000prop",342],["assetKind\u0000scene",69],["category\u0000architecture",29],["category\u0000environments",1],["category\u0000equipment",6],["category\u0000infrastructure",3],["category\u0000modular",7],["category\u0000prop",7],["category\u0000props",396],["category\u0000railway-infrastructure",3],["category\u0000scene",1],["category\u0000scene-compositions",1],["category\u0000scenes",65],["category\u0000vehicles",4],["repository\u0000Shadow3DAssetLibrary",523],["style\u0000S01-clean-geometric",252],["style\u0000S02-hard-edge-faceted",1],["style\u0000S03-warm-handcrafted",1],["style\u0000S08-bright-instrumentation",6],["style\u0000hard-edge-faceted-nature",23],["style\u0000hard-edge-faceted-wetland",1],["style\u0000original-source-mix",1],["style\u0000restrained-faceted-classical",1],["style\u0000restrained-faceted-masonry",2],["style\u0000soft-low-poly",183],["style\u0000soft-low-poly-stone",1],["style\u0000source-preserved-S01-and-satin-metal",1],["style\u0000source-preserved-S01-and-soft-low-poly",8],["style\u0000source-preserved-S01-clean-geometric",1],["style\u0000source-preserved-hard-edge-faceted-nature",1],["style\u0000warm-faceted-oasis",1],["style\u0000warm-handcrafted-bakery",7],["style\u0000warm-handcrafted-retail",2],["style\u0000warm-handcrafted-tailoring",2],["style\u0000warm-handcrafted-village",28],["theme\u0000animal",1],["theme\u0000arcade",8],["theme\u0000astronomy",11],["theme\u0000aviation",8],["theme\u0000baggage",5],["theme\u0000bakery",13],["theme\u0000beach",5],["theme\u0000beekeeping",10],["theme\u0000cafe",2],["theme\u0000camping",10],["theme\u0000carnival",8],["theme\u0000carpentry",7],["theme\u0000cave-mine",2],["theme\u0000ceramics",6],["theme\u0000classical",3],["theme\u0000communications",9],["theme\u0000construction",8],["theme\u0000coral-reef",3],["theme\u0000desert",2],["theme\u0000dining",8],["theme\u0000education",6],["theme\u0000entertainment",1],["theme\u0000entryway",6],["theme\u0000farming",6],["theme\u0000firefighting",8],["theme\u0000fishing",9],["theme\u0000fitness",9],["theme\u0000florist",2],["theme\u0000garden",1],["theme\u0000harbor",16],["theme\u0000hospitality",1],["theme\u0000industrial",5],["theme\u0000interior",16],["theme\u0000kitchen",16],["theme\u0000laboratory",9],["theme\u0000laundry",6],["theme\u0000library",3],["theme\u0000logistics",10],["theme\u0000museum",9],["theme\u0000music",9],["theme\u0000nature",24],["theme\u0000navigation",8],["theme\u0000office",2],["theme\u0000painting",10],["theme\u0000petcare",1],["theme\u0000photography",9],["theme\u0000playground",9],["theme\u0000postal",6],["theme\u0000public",1],["theme\u0000public-service",3],["theme\u0000railway",12],["theme\u0000renewable",7],["theme\u0000retail",3],["theme\u0000robotics",4],["theme\u0000ruins",1],["theme\u0000ruins-repair",1],["theme\u0000salon",1],["theme\u0000spacebase",2],["theme\u0000sports",11],["theme\u0000steam-workshop",3],["theme\u0000tailoring",6],["theme\u0000textile",8],["theme\u0000timekeeping",8],["theme\u0000toys",6],["theme\u0000transport",29],["theme\u0000village",60],["theme\u0000wetland",3],["theme\u0000winter",8]]}
