{"schemaVersion":3,"family":"terms","kind":"branch","children":[{"path":"catalog/v3/94/94ae1d8e9d2dfb9d246db92bd4c568b49da9d418dca15db84589f29d000d57f8.json","size":18394,"sha256":"94ae1d8e9d2dfb9d246db92bd4c568b49da9d418dca15db84589f29d000d57f8","min":"f\u0000assetKind\u0000modular","max":"f\u0000theme\u0000winter","count":114,"height":1},{"path":"catalog/v3/3c/3ccdd2c3230fec19a918d119ecb5fa35b31b581caaf75a28be98936f2f63d24d.json","size":300,"sha256":"3ccdd2c3230fec19a918d119ecb5fa35b31b581caaf75a28be98936f2f63d24d","min":"g\u0000 ","max":"g\u0000 ","count":1,"height":1},{"path":"catalog/v3/00/0066673b0a6604a17b37585cdc453d077b1362e8d8e644b4f1185a9abe8e6900.json","size":13146,"sha256":"0066673b0a6604a17b37585cdc453d077b1362e8d8e644b4f1185a9abe8e6900","min":"g\u0000 (","max":"g\u0000 91","count":122,"height":1},{"path":"catalog/v3/32/325778aeb8d3e69ab6077a48e07216de052facfdff5bce315b5dcab5a25bbe2f.json","size":90799,"sha256":"325778aeb8d3e69ab6077a48e07216de052facfdff5bce315b5dcab5a25bbe2f","min":"g\u0000 a","max":"g\u0000 ox","count":167,"height":1},{"path":"catalog/v3/bf/bff3f99e58c35d7ad4c3593c98a446e9d2084d5855b7f90b945f542e13a8babc.json","size":59608,"sha256":"bff3f99e58c35d7ad4c3593c98a446e9d2084d5855b7f90b945f542e13a8babc","min":"g\u0000 p","max":"g\u0000 zo","count":110,"height":1},{"path":"catalog/v3/d4/d4869c48a1f508ac0783cf09fabf1b2a05a333ae50fb275f2ff4c7e782b699a7.json","size":196,"sha256":"d4869c48a1f508ac0783cf09fabf1b2a05a333ae50fb275f2ff4c7e782b699a7","min":"g\u0000 —","max":"g\u0000 — ","count":2,"height":1},{"path":"catalog/v3/f2/f2b3d4548749855c5b45b7bd1f951daf388dbe951df5856da00b6040f6f6f5c8.json","size":6163,"sha256":"f2b3d4548749855c5b45b7bd1f951daf388dbe951df5856da00b6040f6f6f5c8","min":"g\u0000(","max":"g\u0000+z,","count":84,"height":1},{"path":"catalog/v3/01/018bdbfa6c7a93a3df112fdb47e48cde794d0e34be566b0a90b6070f0c1bd24f.json","size":78229,"sha256":"018bdbfa6c7a93a3df112fdb47e48cde794d0e34be566b0a90b6070f0c1bd24f","min":"g\u0000,","max":"g\u0000-zo","count":314,"height":1},{"path":"catalog/v3/8f/8f3572521f28a2df61c845abe8329ba8fcdf957407ef82456100c62077be3e71.json","size":34831,"sha256":"8f3572521f28a2df61c845abe8329ba8fcdf957407ef82456100c62077be3e71","min":"g\u0000.","max":"g\u0000/z ","count":294,"height":1},{"path":"catalog/v3/5f/5f9a1cdfcf8b3462edc8bd5e052e1fffb0a30d5bdf5acc0f526fc7fc04ba210c.json","size":84350,"sha256":"5f9a1cdfcf8b3462edc8bd5e052e1fffb0a30d5bdf5acc0f526fc7fc04ba210c","min":"g\u00000","max":"g\u0000=z=","count":898,"height":1},{"path":"catalog/v3/8e/8e0a9b1d756777af8d594ae4657c618adb5162d2142c93842421b309b13bfcb5.json","size":6606,"sha256":"8e0a9b1d756777af8d594ae4657c618adb5162d2142c93842421b309b13bfcb5","min":"g\u0000[","max":"g\u0000zzl","count":5806,"height":3},{"path":"catalog/v3/8f/8fc432d792ad1f088de63e0a5d3ea2f90d6ff1be95e2067ae6a25529c3d4b66b.json","size":677,"sha256":"8fc432d792ad1f088de63e0a5d3ea2f90d6ff1be95e2067ae6a25529c3d4b66b","min":"g\u0000–","max":"g\u0000— f","count":10,"height":1}]}
