{"schemaVersion":3,"family":"terms","kind":"leaf","entries":[["g\u0000e",{"path":"catalog/v3/f1/f17a1f69b47d669555a018ab35d2c40b325110a49b9b557a3446a035d8f2e6c1.json","size":2068,"sha256":"f17a1f69b47d669555a018ab35d2c40b325110a49b9b557a3446a035d8f2e6c1","min":0,"max":527,"count":528,"height":1}]]}
