{"schemaVersion":3,"family":"terms","kind":"branch","children":[{"path":"catalog/v3/78/78499d87cd69ee1b72c86c3d7316457a4d741b06aa3130eb16fb2377433a2a6a.json","size":1891,"sha256":"78499d87cd69ee1b72c86c3d7316457a4d741b06aa3130eb16fb2377433a2a6a","min":"g\u0000[","max":"g\u0000_st","count":28,"height":1},{"path":"catalog/v3/d3/d3b53440ce5715e3ab83843481538ef07989b92d6309990254585310ad79c2b7.json","size":97944,"sha256":"d3b53440ce5715e3ab83843481538ef07989b92d6309990254585310ad79c2b7","min":"g\u0000a","max":"g\u0000azi","count":350,"height":1},{"path":"catalog/v3/18/180f58a544daddbd6d4d9a556c415e3aaaa905eacbbca304c1d4928ebd452908.json","size":94700,"sha256":"180f58a544daddbd6d4d9a556c415e3aaaa905eacbbca304c1d4928ebd452908","min":"g\u0000b","max":"g\u0000cym","count":383,"height":1},{"path":"catalog/v3/2e/2eca38f3a7265c3c802d94c939d46b8186363a6c4d1ef90d86ea4c6bd40a66a6.json","size":60323,"sha256":"2eca38f3a7265c3c802d94c939d46b8186363a6c4d1ef90d86ea4c6bd40a66a6","min":"g\u0000d","max":"g\u0000dyn","count":236,"height":1},{"path":"catalog/v3/c1/c141cb1c907a274ad07c14103892d3625996700c36571200e68e6603cb3a5670.json","size":300,"sha256":"c141cb1c907a274ad07c14103892d3625996700c36571200e68e6603cb3a5670","min":"g\u0000e","max":"g\u0000e","count":1,"height":1},{"path":"catalog/v3/7e/7e0a32516ddea54152eeb5deec0b0a5214b7adce48d4839babdb225f929d97df.json","size":32216,"sha256":"7e0a32516ddea54152eeb5deec0b0a5214b7adce48d4839babdb225f929d97df","min":"g\u0000e ","max":"g\u0000e; ","count":102,"height":1},{"path":"catalog/v3/58/5862c546590d7b4f994ed51651cac2477d526499740cb6813bf9729b27990f87.json","size":270,"sha256":"5862c546590d7b4f994ed51651cac2477d526499740cb6813bf9729b27990f87","min":"g\u0000e_","max":"g\u0000e_r","count":3,"height":1},{"path":"catalog/v3/26/2666c90c7a85f6d70e20eba4808e9039990bb24413ca80434c13cbfbdaffb69e.json","size":57134,"sha256":"2666c90c7a85f6d70e20eba4808e9039990bb24413ca80434c13cbfbdaffb69e","min":"g\u0000ea","max":"g\u0000eou","count":185,"height":1},{"path":"catalog/v3/ff/ff9e206a79e213d546d978a2483a00d037b67ec997b7ff310722ec0bc5ee62c9.json","size":45372,"sha256":"ff9e206a79e213d546d978a2483a00d037b67ec997b7ff310722ec0bc5ee62c9","min":"g\u0000ep","max":"g\u0000ezo","count":135,"height":1},{"path":"catalog/v3/a4/a4938b994f0a7193dd4ad02f310104cae91afc961b6ddfa59a623ddf53d15654.json","size":82385,"sha256":"a4938b994f0a7193dd4ad02f310104cae91afc961b6ddfa59a623ddf53d15654","min":"g\u0000f","max":"g\u0000gza","count":380,"height":1},{"path":"catalog/v3/49/4956c8de2566f90c9e462ff88f87edbb7c0c7bdc641b6d7c7ee3bd232178c19a.json","size":43971,"sha256":"4956c8de2566f90c9e462ff88f87edbb7c0c7bdc641b6d7c7ee3bd232178c19a","min":"g\u0000h","max":"g\u0000hys","count":198,"height":1},{"path":"catalog/v3/4e/4eead585bfee6927b961b1c0fb0ed5d0c6e48a2cfa9c22e15b17278b6ac03988.json","size":89600,"sha256":"4eead585bfee6927b961b1c0fb0ed5d0c6e48a2cfa9c22e15b17278b6ac03988","min":"g\u0000i","max":"g\u0000izz","count":283,"height":1},{"path":"catalog/v3/75/759698e00aa76feef95b844415f4773aeef19271dcc6d27fb810068ce9457fe2.json","size":23380,"sha256":"759698e00aa76feef95b844415f4773aeef19271dcc6d27fb810068ce9457fe2","min":"g\u0000j","max":"g\u0000kya","count":164,"height":1},{"path":"catalog/v3/02/02e08844810a4994445d3c54a02d0ee16c5d090b4e3dd588670dc7ce379eea1a.json","size":78971,"sha256":"02e08844810a4994445d3c54a02d0ee16c5d090b4e3dd588670dc7ce379eea1a","min":"g\u0000l","max":"g\u0000lyw","count":299,"height":1},{"path":"catalog/v3/75/7524de9c573c263ef6f111d508108b1842445c6380b7fb1c40f52aba3644ee88.json","size":44685,"sha256":"7524de9c573c263ef6f111d508108b1842445c6380b7fb1c40f52aba3644ee88","min":"g\u0000m","max":"g\u0000my-","count":195,"height":1},{"path":"catalog/v3/5a/5abcc05c884eaa925a84222d9e73da02552cb70ee867cc85a227c680ec821625.json","size":300,"sha256":"5abcc05c884eaa925a84222d9e73da02552cb70ee867cc85a227c680ec821625","min":"g\u0000n","max":"g\u0000n","count":1,"height":1},{"path":"catalog/v3/2e/2e52e1b02a25b3f776a93638fd5ef0789b573bc21e219ed2f1a0f4c5ce783a62.json","size":98093,"sha256":"2e52e1b02a25b3f776a93638fd5ef0789b573bc21e219ed2f1a0f4c5ce783a62","min":"g\u0000n ","max":"g\u0000nze","count":319,"height":1},{"path":"catalog/v3/60/60366773867146a1e798f5bd9c1a16793b0a5b5dcf16a8a69908cc845058e1e8.json","size":300,"sha256":"60366773867146a1e798f5bd9c1a16793b0a5b5dcf16a8a69908cc845058e1e8","min":"g\u0000o","max":"g\u0000o","count":1,"height":1},{"path":"catalog/v3/b2/b255755d36475da2a10e97625101d17dc3339be1e8a98898cea15997efb67976.json","size":10895,"sha256":"b255755d36475da2a10e97625101d17dc3339be1e8a98898cea15997efb67976","min":"g\u0000o ","max":"g\u0000o90","count":58,"height":1},{"path":"catalog/v3/3e/3ea639e9f053c97eea38050efa0db9bce0fa2c731482f1dd4821e526688c2e36.json","size":95078,"sha256":"3ea639e9f053c97eea38050efa0db9bce0fa2c731482f1dd4821e526688c2e36","min":"g\u0000oa","max":"g\u0000ozz","count":309,"height":1},{"path":"catalog/v3/a6/a654619c65e791146998cfae3c3648e4a7608338bc0b8e9a6a71d47e1f1fa344.json","size":61359,"sha256":"a654619c65e791146998cfae3c3648e4a7608338bc0b8e9a6a71d47e1f1fa344","min":"g\u0000p","max":"g\u0000qui","count":211,"height":1},{"path":"catalog/v3/e3/e379f1f4eb47889fe152a6612810cf9de920ecb8b0170b30943c2dd06f3c4e6e.json","size":300,"sha256":"e379f1f4eb47889fe152a6612810cf9de920ecb8b0170b30943c2dd06f3c4e6e","min":"g\u0000r","max":"g\u0000r","count":1,"height":1},{"path":"catalog/v3/fb/fbb869000ca4e3f4c4e63a9d36e72448d0b99192f1c198965ef74a9d8fe78639.json","size":21029,"sha256":"fbb869000ca4e3f4c4e63a9d36e72448d0b99192f1c198965ef74a9d8fe78639","min":"g\u0000r ","max":"g\u0000r; ","count":76,"height":1},{"path":"catalog/v3/45/4544d529bbb3f7ae283e114f7646e8e9569cedb8d786463d3283534a8667c454.json","size":81813,"sha256":"4544d529bbb3f7ae283e114f7646e8e9569cedb8d786463d3283534a8667c454","min":"g\u0000r_","max":"g\u0000rz=","count":291,"height":1},{"path":"catalog/v3/22/22120e174053c57eba559ba77d5db0efbc722a62be71d42a081ad59d5dc0b89d.json","size":87517,"sha256":"22120e174053c57eba559ba77d5db0efbc722a62be71d42a081ad59d5dc0b89d","min":"g\u0000s","max":"g\u0000sys","count":302,"height":1},{"path":"catalog/v3/2a/2ad1aa91da4e205f80e9046180009dfe92b62094b250315908e78b226c50944f.json","size":300,"sha256":"2ad1aa91da4e205f80e9046180009dfe92b62094b250315908e78b226c50944f","min":"g\u0000t","max":"g\u0000t","count":1,"height":1},{"path":"catalog/v3/2f/2ff011603945dcf0fadea18fdd703cde65a7d00c93b1b318f9a14fee20b74604.json","size":23868,"sha256":"2ff011603945dcf0fadea18fdd703cde65a7d00c93b1b318f9a14fee20b74604","min":"g\u0000t ","max":"g\u0000t; ","count":88,"height":1},{"path":"catalog/v3/be/be99a55037d984f428dcc7bd0fdbefef3db6d06508e25974a7770b4ce86847bd.json","size":75354,"sha256":"be99a55037d984f428dcc7bd0fdbefef3db6d06508e25974a7770b4ce86847bd","min":"g\u0000t_","max":"g\u0000tyr","count":192,"height":1},{"path":"catalog/v3/2a/2a035ed116af4673b2fcd201306581154dce9d29e25001c05299eaf636c8c630.json","size":54606,"sha256":"2a035ed116af4673b2fcd201306581154dce9d29e25001c05299eaf636c8c630","min":"g\u0000u","max":"g\u0000uzz","count":233,"height":1},{"path":"catalog/v3/bd/bd012f7c978e9d0e429d13df457290586a04c46a5048732a0f9dee2afce1c7f2.json","size":43587,"sha256":"bd012f7c978e9d0e429d13df457290586a04c46a5048732a0f9dee2afce1c7f2","min":"g\u0000v","max":"g\u0000wy ","count":200,"height":1},{"path":"catalog/v3/8c/8c34de152e35c94d42766d8babb2b50b6b36a887b0e6fe5fbcafdc04acfd801a.json","size":53426,"sha256":"8c34de152e35c94d42766d8babb2b50b6b36a887b0e6fe5fbcafdc04acfd801a","min":"g\u0000x","max":"g\u0000zzl","count":339,"height":1}]}
