{"schemaVersion":3,"family":"terms","kind":"branch","children":[{"path":"catalog/v3/78/78499d87cd69ee1b72c86c3d7316457a4d741b06aa3130eb16fb2377433a2a6a.json","size":1891,"sha256":"78499d87cd69ee1b72c86c3d7316457a4d741b06aa3130eb16fb2377433a2a6a","min":"g\u0000[","max":"g\u0000_st","count":28,"height":1},{"path":"catalog/v3/94/9464263c611f76ed579f235c3ecfb07f809f0f519522e21f30c54fd072b1ea4c.json","size":97624,"sha256":"9464263c611f76ed579f235c3ecfb07f809f0f519522e21f30c54fd072b1ea4c","min":"g\u0000a","max":"g\u0000azi","count":344,"height":1},{"path":"catalog/v3/9a/9af20f0a331fa785ab226bb00269ce85110c342cbfd4e15fadab3718bb99f3ee.json","size":88354,"sha256":"9af20f0a331fa785ab226bb00269ce85110c342cbfd4e15fadab3718bb99f3ee","min":"g\u0000b","max":"g\u0000cym","count":379,"height":1},{"path":"catalog/v3/ca/ca13f5086482711e762fff83658593abb75fd663e250fa18007dbabdf7e3fa9a.json","size":58322,"sha256":"ca13f5086482711e762fff83658593abb75fd663e250fa18007dbabdf7e3fa9a","min":"g\u0000d","max":"g\u0000dyn","count":229,"height":1},{"path":"catalog/v3/e3/e36bcef1b67f64cabb3d7a062f69f07b013d8ea772568c1b91f976c68a593738.json","size":1926,"sha256":"e36bcef1b67f64cabb3d7a062f69f07b013d8ea772568c1b91f976c68a593738","min":"g\u0000e","max":"g\u0000e","count":1,"height":1},{"path":"catalog/v3/21/213355ee736410356d6afd2567c3357d048f2b653381e8ffd5df1a51eab85e00.json","size":30927,"sha256":"213355ee736410356d6afd2567c3357d048f2b653381e8ffd5df1a51eab85e00","min":"g\u0000e ","max":"g\u0000e; ","count":102,"height":1},{"path":"catalog/v3/4c/4cb136220eb29f796515a823f112dc4dfa557399996d7f308a582e11530fdc68.json","size":93027,"sha256":"4cb136220eb29f796515a823f112dc4dfa557399996d7f308a582e11530fdc68","min":"g\u0000e_","max":"g\u0000ezo","count":315,"height":1},{"path":"catalog/v3/75/752f3f46ed932a7428113448e4861985955ba84656ab4d66af2495519e827462.json","size":79000,"sha256":"752f3f46ed932a7428113448e4861985955ba84656ab4d66af2495519e827462","min":"g\u0000f","max":"g\u0000gza","count":369,"height":1},{"path":"catalog/v3/21/21047bd9275ee504c22c0deddb7ce3c72c3e01bf4c19b60ae714d39cda6a563e.json","size":42163,"sha256":"21047bd9275ee504c22c0deddb7ce3c72c3e01bf4c19b60ae714d39cda6a563e","min":"g\u0000h","max":"g\u0000hys","count":194,"height":1},{"path":"catalog/v3/db/db12fbf47206adeba930ff96fb5fa3dd6e0106fc5096c02ad637b487bac7d3ce.json","size":86549,"sha256":"db12fbf47206adeba930ff96fb5fa3dd6e0106fc5096c02ad637b487bac7d3ce","min":"g\u0000i","max":"g\u0000izo","count":280,"height":1},{"path":"catalog/v3/55/5597f4bb721e021bd0a10d5b81805aff5381f5fbe31ea2a8ef3aca65e97dab10.json","size":21849,"sha256":"5597f4bb721e021bd0a10d5b81805aff5381f5fbe31ea2a8ef3aca65e97dab10","min":"g\u0000j","max":"g\u0000kya","count":161,"height":1},{"path":"catalog/v3/36/3688d4407aa241fcfe6a24678f114d6a8477fd44c0fcc63a699a79dc7d20aedf.json","size":74645,"sha256":"3688d4407aa241fcfe6a24678f114d6a8477fd44c0fcc63a699a79dc7d20aedf","min":"g\u0000l","max":"g\u0000lys","count":282,"height":1},{"path":"catalog/v3/e6/e687ad46ccf76dfb20c8f33a22c44882f1c803d884c87fe73017d1901e36e0ba.json","size":42740,"sha256":"e687ad46ccf76dfb20c8f33a22c44882f1c803d884c87fe73017d1901e36e0ba","min":"g\u0000m","max":"g\u0000my-","count":194,"height":1},{"path":"catalog/v3/b8/b871a55a0126fd1d6d8e7070ad503e1fe2e06f803bcf271e7e54b0930568634c.json","size":92391,"sha256":"b871a55a0126fd1d6d8e7070ad503e1fe2e06f803bcf271e7e54b0930568634c","min":"g\u0000n","max":"g\u0000nze","count":312,"height":1},{"path":"catalog/v3/a6/a641937c273f2a52ae4a903260caca06e51711f313498b5ffcd74e9dbcf6bb58.json","size":1926,"sha256":"a641937c273f2a52ae4a903260caca06e51711f313498b5ffcd74e9dbcf6bb58","min":"g\u0000o","max":"g\u0000o","count":1,"height":1},{"path":"catalog/v3/9f/9fe3ca8012ac1b9ebaeae16c206b9f63215e684d29d320b513f071680204fb46.json","size":10090,"sha256":"9fe3ca8012ac1b9ebaeae16c206b9f63215e684d29d320b513f071680204fb46","min":"g\u0000o ","max":"g\u0000o90","count":58,"height":1},{"path":"catalog/v3/2a/2af8d7e94989cdf8a1620213911c6d68f6e6af705d11a43cca852e68abf4304e.json","size":88739,"sha256":"2af8d7e94989cdf8a1620213911c6d68f6e6af705d11a43cca852e68abf4304e","min":"g\u0000oa","max":"g\u0000ozz","count":305,"height":1},{"path":"catalog/v3/fe/fe76cfa88718ff927ea9f2b9dcc585ae063bcc3053c785cb5410d95c7af516f7.json","size":57722,"sha256":"fe76cfa88718ff927ea9f2b9dcc585ae063bcc3053c785cb5410d95c7af516f7","min":"g\u0000p","max":"g\u0000qui","count":207,"height":1},{"path":"catalog/v3/5b/5b1d2d0cb8aa6daa636ee6dc3fe7de93b21c4fd866cbb98d64539958253435d7.json","size":95712,"sha256":"5b1d2d0cb8aa6daa636ee6dc3fe7de93b21c4fd866cbb98d64539958253435d7","min":"g\u0000r","max":"g\u0000rz=","count":366,"height":1},{"path":"catalog/v3/19/190dffbce1bc4d82c4b7238119160d92fc0a0b5b54c48ea55e74df05d9b61c72.json","size":83156,"sha256":"190dffbce1bc4d82c4b7238119160d92fc0a0b5b54c48ea55e74df05d9b61c72","min":"g\u0000s","max":"g\u0000sys","count":296,"height":1},{"path":"catalog/v3/eb/ebf5a0a49adc9f3ec8b5ee41f8b73a497feb6c0a006d3e8833f30f4eeb6a5646.json","size":92678,"sha256":"ebf5a0a49adc9f3ec8b5ee41f8b73a497feb6c0a006d3e8833f30f4eeb6a5646","min":"g\u0000t","max":"g\u0000tyr","count":276,"height":1},{"path":"catalog/v3/c5/c57dc92ca83e323ac2e7eff1d4832b8afe3875717f3564807cb7be67c4a1f7e2.json","size":49369,"sha256":"c57dc92ca83e323ac2e7eff1d4832b8afe3875717f3564807cb7be67c4a1f7e2","min":"g\u0000u","max":"g\u0000uzz","count":222,"height":1},{"path":"catalog/v3/5e/5e154106e28bdb6923857a31f563ac4adeec23aa3652939caf7f7d1690cb14c5.json","size":41791,"sha256":"5e154106e28bdb6923857a31f563ac4adeec23aa3652939caf7f7d1690cb14c5","min":"g\u0000v","max":"g\u0000wy ","count":197,"height":1},{"path":"catalog/v3/55/5562875b2ff358d34c055a8a4efa17c35d8e4f45718e1dd6fdb3cbfb87d28d52.json","size":50561,"sha256":"5562875b2ff358d34c055a8a4efa17c35d8e4f45718e1dd6fdb3cbfb87d28d52","min":"g\u0000x","max":"g\u0000zzl","count":330,"height":1}]}
